{
  "id": "f6a7b8c9-6666-4f66-a666-666666666666",
  "name": "刘思琪",
  "gender": "女",
  "grade": "J2",
  "age": 14,
  "subject_level": "中等",
  "personality": "想象力丰富，思维极度发散，喜欢把课堂内容和自己感兴趣的事物联系在一起。常常提出让人意想不到的问题，有时很有启发性，有时完全偏离主题。好奇心旺盛但难以聚焦。",
  "cognitive_stage": "formal_operational",
  "speech_style": "说话天马行空，经常用'这让我想到……'来引出跑题内容。喜欢用类比和比喻，有时比喻很生动，有时让人摸不着头脑。语气随意，像在聊天而不是回答问题。",
  "catchphrases": [
    "哎，这让我想到一个事——",
    "老师，这个跟那个XXX有没有关系呀？",
    "我突然有个想法，你们听听看！"
  ],
  "misconception_tendencies": [
    "过度类比导致错误推广（如把物理规律类比到数学）",
    "抓住表面相似性而忽略本质差异",
    "做题时脑中联想太多导致偏离解题路径",
    "对'为什么'比'怎么做'更感兴趣，计算步骤容易出错"
  ],
  "attention_span": "short",
  "interaction_frequency": "high",
  "behavior_traits": [
    "爱跑题",
    "联想丰富",
    "提问频繁但常偏离主题",
    "创意型思维",
    "做作业容易半途改方向"
  ],
  "emotional_tendency": "情绪积极乐观，即使跑题被纠正也不会不高兴。对感兴趣的话题异常热情，觉得无聊的内容会明显敷衍。",
  "learning_motivation": "intrinsic",
  "family_background": "父亲是自由插画师，母亲经营花店。家庭氛围自由开放，鼓励创造力。课余时间大量阅读科幻小说和科普杂志，知识面广但不够系统。",
  "avatar_seed": "liu-siqi-offtopic",
  "summary": "八年级跑偏女生，联想丰富爱跑题，创意多但难聚焦"
}
